{
 "schema_version": 1,
 "id": "l1-t1-05",
 "level": 1,
 "term": 1,
 "lesson": 5,
 "lesson_in_term": 5,
 "title": "Make-a-Ten Adding",
 "big_idea": "Make tens first",
 "child_idea": "To add, fill up a ten first. Move some from the other number to make a full ten, then add what is left.",
 "skill": "Strategy choice",
 "ages": "6-8",
 "moe": {
  "strand": "Addition and Subtraction",
  "topics": [
   "Adding more than two 1-digit numbers",
   "Addition within 100 by making a ten (mental method first)",
   "Written algorithms are not taught in this lesson"
  ],
  "note": "Strand label for the tutor only. It is not a claim that the program covers the school syllabus, and it must not appear on child or parent pages as 'MOE-aligned'. Syllabus check for the owner or a tutor: the P1 outline names adding more than two 1-digit numbers, addition within 100 and mental calculation of a 2-digit number plus ones without renaming. Crossing a ten (28 + 6) by making a ten is this program's own mental method, placed in Start here by the plan; confirm that placement."
 },
 "contest_moves": [
  "add by making tens (pair the numbers that make 10)",
  "reorder an addition to find pairs that make a ten or a tens number"
 ],
 "objectives": [
  "Say how many more make 10 from any number to 9, and how many more make the next ten from a two-digit number.",
  "Add two numbers that cross a ten (8 + 6, 28 + 6) by filling up a ten first and adding what is left, and explain why the total does not change.",
  "Add three or more numbers by finding pairs that make 10 or a tens number, in any order.",
  "Choose which number to fill up and see that moving objects between groups keeps the total the same."
 ],
 "joining_cold": {
  "remember": [
   "How many more make 10 (bonds to 10) with a ten-frame and fingers",
   "How many more make the next ten (bonds to 20: 14 + 6, and 18 + 2, 26 + 4)",
   "Tens and ones put together (30 and 6 is 36)"
  ],
  "assumes": "Only counting to 20, showing a number with fingers and knowing that ten ones make a ten. Nothing from the earlier Term 1 lessons is needed: the warm-up builds tens and ones with a ten-frame and the kit.",
  "holiday_topics_revisited": [
   "Number bonds to 10 and 20 (Number Bond Inquiry)"
  ],
  "safe_to_miss": false,
  "note": "Lesson 5 is one of the hardest to miss in Term 1 (plan, section 2): Lesson 6 builds on it. A child who misses it watches the recording and does workbook pages 1 and 2 before Lesson 6."
 },
 "materials": {
  "child": [
   "About 20 small things of two kinds (buttons, pasta, clips)",
   "Paper to draw a ten-frame on, or the tens bar from the kit page",
   "The printed workbook and the kit page, cut out by a grown-up",
   "A pencil, a rubber and spare paper"
  ],
  "tutor": [
   "A slide deck and a paper ten-frame with two kinds of counters to show on camera if you wish",
   "A visible clock"
  ],
  "kit_pages": [
   "Tens bars (9) and ones squares (20), printed on page 6 of the workbook; cut out before the lesson. This lesson uses up to 5 bars and 14 squares at a time"
  ],
  "ruler": false,
  "notes": "No ruler is needed. Nothing needs to be bought: everything can be found at home. No matches, toothpicks or anything sharp. Small things never go near the mouth or ears."
 },
 "timing": {
  "parts": [
   {
    "id": "opening",
    "title": "Opening",
    "start": 0,
    "end": 2
   },
   {
    "id": "remember",
    "title": "Remember warm-up",
    "start": 2,
    "end": 8
   },
   {
    "id": "sneak",
    "title": "Sneak-peek puzzles",
    "start": 8,
    "end": 12
   },
   {
    "id": "explore",
    "title": "Explore",
    "start": 12,
    "end": 28
   },
   {
    "id": "mini",
    "title": "Mini-lesson",
    "start": 28,
    "end": 38
   },
   {
    "id": "break",
    "title": "Brain break",
    "start": 38,
    "end": 42
   },
   {
    "id": "work",
    "title": "Workbook",
    "start": 42,
    "end": 70
   },
   {
    "id": "talk",
    "title": "Talk time",
    "start": 70,
    "end": 76
   },
   {
    "id": "exit",
    "title": "Exit ticket",
    "start": 76,
    "end": 82
   },
   {
    "id": "look",
    "title": "Look-back",
    "start": 82,
    "end": 85
   },
   {
    "id": "flex",
    "title": "Flex time and goodbye",
    "start": 85,
    "end": 90
   }
  ],
  "optional_slide": "s-opt",
  "include_rules": false,
  "notes": "Opening is 2 minutes (the routine and rules were taught in Lesson 1; say the recording notice in one line). The 2 minutes saved go to Explore (16 minutes). The last 5 minutes are the standing buffer; the optional Go further slide is used only if the lesson is on time."
 },
 "sneak_peek": {
  "q1": "Count all the counters. Write how many. You may draw rings round groups to help.",
  "q2": "Ben has 9 red counters and 5 blue counters. He moves 1 blue counter over to the red ones. Now he has 10 red and 4 blue. Is the total the same as before? Write yes or no, and why.",
  "a1": "12",
  "a2": "Yes. Nothing was added or taken away. 9 + 5 = 14 and 10 + 4 = 14.",
  "val1": 12
 },
 "rec": {
  "opening": {
   "say": "If you are watching the recording: hello! Get a pencil, paper, your workbook, your kit pieces and a few small things. Pause or rewind any time.",
   "action": "Gather your workbook, pencil, paper, kit pieces and small things. Press play when ready."
  },
  "remember": {
   "say": "Recording: join in! Show your answers on your fingers before I say them. Pause if you need longer.",
   "action": "Play along. Show each answer on your fingers before the video does."
  },
  "sneak": {
   "say": "Recording: pause now and try both puzzles on your paper. Guessing is fine. Press play for the next part.",
   "action": "Pause. Try both puzzles on your own paper. A guess is fine."
  },
  "explore": {
   "say": "Recording: pause now. Draw a ten-frame, move your things to make a ten, then say what is left. Press play when you have tried.",
   "action": "Pause. Draw a ten-frame and make a ten with your things each time I call a sum. Write what you find."
  },
  "mini": {
   "say": "Recording: keep watching and copy the examples. Rewind if you miss a step.",
   "action": "Watch and copy the examples. Rewind any step you missed."
  },
  "break": {
   "say": "Recording: stand up and join in! Stomp the number that makes ten.",
   "action": "Stand up and stomp how many more make ten."
  },
  "work": {
   "say": "Recording: pause now and do workbook page 1. When you finish a page, press play to check it.",
   "action": "Pause. Do page 1, then play to check. Then page 2. Then choose a page to try."
  },
  "talk": {
   "say": "Recording: pause. Tell a grown-up who is right, and show them with counters.",
   "action": "Pause. Explain your answer to someone at home, with counters and a reason."
  },
  "exit": {
   "say": "Recording: pause and do the exit ticket on your own. Then press play to check it.",
   "action": "Pause. Do the exit ticket alone, then play to check it."
  },
  "look": {
   "say": "Recording: pause and fill in your look-back box. You can pass.",
   "action": "Pause. Fill in the look-back box, or pass."
  },
  "flex": {
   "say": "Recording: well done for finishing! Show a grown-up one thing you found out.",
   "action": "Show a grown-up your workbook and tell them one thing you found out."
  }
 },
 "script": {
  "segments": [
   {
    "part": "opening",
    "lines": [
     {
      "k": "SLIDE",
      "slide": "s-title"
     },
     {
      "k": "REC",
      "text": "@rec"
     },
     {
      "k": "SAY",
      "text": "Good morning, inquirers! Cameras on if you like, pencil ready, a few small things and your kit pieces on the table. Today we learn a trick for adding without counting one by one: make a ten first."
     },
     {
      "k": "DO",
      "text": "Greet each child by first name and check their camera shows their page and hands.",
      "s": 30
     },
     {
      "k": "NOTE",
      "text": "Remind the group once, in one line, that the lesson is recorded (you and the screen only) and that a child may keep the camera off. The routine and the four inquirer rules were introduced in Lesson 1: do not re-teach them."
     }
    ]
   },
   {
    "part": "remember",
    "lines": [
     {
      "k": "SLIDE",
      "slide": "s-rem1"
     },
     {
      "k": "REC",
      "text": "@rec"
     },
     {
      "k": "SAY",
      "text": "Fingers and a ten-frame. A ten-frame has ten spaces. When it is full, that is a ten. I say how many counters are in the frame. You show me, on your fingers, how many more fill it up."
     },
     {
      "k": "ASK",
      "text": "Seven counters. How many more to make ten?",
      "resp": 12
     },
     {
      "k": "ASK",
      "text": "Four?",
      "resp": 12
     },
     {
      "k": "ASK",
      "text": "Nine?",
      "resp": 12
     },
     {
      "k": "ASK",
      "text": "Five?",
      "resp": 12
     },
     {
      "k": "ASK",
      "text": "Two?",
      "resp": 12
     },
     {
      "k": "SLIDE",
      "slide": "s-rem2"
     },
     {
      "k": "SAY",
      "text": "Now bigger numbers. Eighteen is one ten and eight ones. How many more ones make the next ten?"
     },
     {
      "k": "ASK",
      "text": "Eighteen. How many more to make twenty?",
      "resp": 12
     },
     {
      "k": "ASK",
      "text": "Fourteen, to make twenty?",
      "resp": 12
     },
     {
      "k": "ASK",
      "text": "Twenty-six, to make thirty?",
      "resp": 12
     },
     {
      "k": "ASK",
      "text": "Thirty-nine, to make forty?",
      "resp": 12
     },
     {
      "k": "SLIDE",
      "slide": "s-rem3"
     },
     {
      "k": "SAY",
      "text": "Last one. Tens and ones put together. Say the tens first, then the ones."
     },
     {
      "k": "ASK",
      "text": "Thirty and six more makes?",
      "resp": 10
     },
     {
      "k": "ASK",
      "text": "Forty and two more?",
      "resp": 10
     },
     {
      "k": "ASK",
      "text": "Fifty and nine more?",
      "resp": 10
     },
     {